{
    "id": "mfrc522",
    "type": "extensions",
    "repository": "https://github.com/openblock-plugin/mfrc522",
    "display": {
        "name": {
            "id": "mfrc522.name",
            "default": "MFRC-522 Module"
        },
        "description": {
            "id": "mfrc522.description",
            "default": "13.56MHz radio frequency identification module using spi interface."
        },
        "helpLink": "https://wiki.openblock.cc",
        "tags": [
            "other"
        ],
        "author": "ArthurZheng"
    },
    "icons": {
        "iconURL": "sha256:706c8cc054adb930664b592a6a96bcefa378d61abb0d0d8aa8a156f3f14849bc"
    },
    "displayHash": "sha256:8951ac30a168639b07de903ca18b8ce602c05dfc7eca0dfe30d13b92da297fa7"
}
